{
  "schemaVersion": 1,
  "testId": "ffipc_framing_tests",
  "category": "ipc-lifecycle",
  "command": "build/debug/tests/ipc/ffipc_framing_tests.exe",
  "commit": "ae41031dc726a4a4328a3536d11348f90b2dd54c",
  "tree": "bdbb97f452e529a2652d1d64a7c622389952b834",
  "exactTreeBound": true,
  "executableHash": "d6c79714d2537e01969855f74c6fb276d757a3b5e6e71bad46d0db2488ecffe0",
  "environment": {
    "os": "Microsoft Windows NT 10.0.26200.0",
    "architecture": "AMD64",
    "computer": "<local-host>",
    "powershell": "7.6.5"
  },
  "startUtc": "2026-09-04T06:01:01.3380759Z",
  "endUtc": "2026-09-04T06:03:47.6376174Z",
  "requestedIterations": 100,
  "completedIterations": 100,
  "passed": 100,
  "failed": 0,
  "timedOut": 0,
  "skipped": 0,
  "minDurationMs": 1625.94,
  "medianDurationMs": 1641.75,
  "p95DurationMs": 1775.98,
  "maxDurationMs": 1895.39,
  "firstFailure": null,
  "artifactHashes": {},
  "disposition": "PASS"
}
