{
  "schemaVersion": 1,
  "testId": "ffdialog_focus_return_tests",
  "category": "uia",
  "command": "build/debug/tests/ui/ffdialog_focus_return_tests.exe",
  "commit": "67f06b5203241cf8c6384bc58173fc6eba9bf2fb",
  "tree": "01dae7925217684c945bcaf90d717fa4448b60c8",
  "exactTreeBound": true,
  "executableHash": "15ed80f67ad0b347467ed0771c5735a7f0ebef07342b64cfa00f8f5306077b77",
  "environment": {
    "os": "Microsoft Windows NT 10.0.26200.0",
    "architecture": "AMD64",
    "computer": "<local-host>",
    "powershell": "7.6.5"
  },
  "startUtc": "2026-09-04T02:50:48.5047089Z",
  "endUtc": "2026-09-04T02:50:55.1516846Z",
  "requestedIterations": 50,
  "completedIterations": 50,
  "passed": 50,
  "failed": 0,
  "timedOut": 0,
  "skipped": 0,
  "minDurationMs": 96.74,
  "medianDurationMs": 118.41,
  "p95DurationMs": 203.82,
  "maxDurationMs": 363.58,
  "firstFailure": null,
  "artifactHashes": {},
  "disposition": "PASS"
}
